<?xml version="1.0" encoding="UTF-8"?>
<tns:Configuration hierarchy="sk" description="Slovakia"
	xmlns:tns="http://www.example.org/Holiday" xmlns:xsi="http://www.w3.org/2001/XMLSchema-instance"
	xsi:schemaLocation="http://www.example.org/Holiday /Holiday.xsd">
	<tns:Holidays>
		<tns:Fixed month="JANUARY" day="1" descriptionPropertiesKey="NEW_YEAR"/>
		<tns:Fixed month="JANUARY" day="6" />
		<tns:Fixed month="MAY" day="1" descriptionPropertiesKey="LABOUR_DAY"/>
		<tns:Fixed month="MAY" day="8" />
		<tns:Fixed month="JULY" day="5" />
		<tns:Fixed month="AUGUST" day="29" />
		<tns:Fixed month="SEPTEMBER" day="1" />
		<tns:Fixed month="SEPTEMBER" day="15" />
		<tns:Fixed month="NOVEMBER" day="1" />
		<tns:Fixed month="NOVEMBER" day="17" />
		<tns:Fixed month="DECEMBER" day="24" descriptionPropertiesKey="CHRISTMAS_EVE"/>
		<tns:Fixed month="DECEMBER" day="25" descriptionPropertiesKey="CHRISTMAS"/>
		<tns:Fixed month="DECEMBER" day="26" />
		<tns:ChristianHoliday type="EASTER" />
		<tns:ChristianHoliday type="GOOD_FRIDAY" />
		<tns:ChristianHoliday type="EASTER_MONDAY" />
	</tns:Holidays>
</tns:Configuration>
