<?xml version="1.0" encoding="UTF-8"?>
<tns:Configuration hierarchy="kz" description="Kazakhstan"
	xmlns:tns="http://www.example.org/Holiday" xmlns:xsi="http://www.w3.org/2001/XMLSchema-instance"
	xsi:schemaLocation="http://www.example.org/Holiday /Holiday.xsd">
	<tns:Holidays>
		<tns:Fixed month="JANUARY" day="1" descriptionPropertiesKey="NEW_YEAR"/>
		<tns:Fixed month="JANUARY" day="7" descriptionPropertiesKey="CHRISTMAS"/>
		<tns:Fixed month="MARCH" day="8" descriptionPropertiesKey="INTERNATIONAL_WOMAN"/>
		<tns:Fixed month="MARCH" day="22" descriptionPropertiesKey="SPRING_DAY"/>
		<tns:Fixed month="MAY" day="1" descriptionPropertiesKey="LABOUR_DAY"/>
		<tns:Fixed month="MAY" day="9" descriptionPropertiesKey="VICTORY"/>
		<tns:Fixed month="JULY" day="6" descriptionPropertiesKey="REPUBLIC_DAY"/>
		<tns:Fixed month="AUGUST" day="30" descriptionPropertiesKey="CONSTITUTION_DAY"/>
		<tns:Fixed month="DECEMBER" day="16" descriptionPropertiesKey="INDEPENDENCE"/>
		<tns:IslamicHoliday type="ID_UL_ADHA"/>
	</tns:Holidays>
</tns:Configuration>
