<?xml version="1.0" encoding="UTF-8"?>
<tns:Configuration hierarchy="cz" description="Czech Republic" xmlns:tns="http://www.example.org/Holiday" xmlns:xsi="http://www.w3.org/2001/XMLSchema-instance" xsi:schemaLocation="http://www.example.org/Holiday Holiday.xsd ">
  <tns:Holidays>
	  <tns:Fixed month="JANUARY" day="1"/>
	  <tns:Fixed month="MAY" day="1"/>
	  <tns:Fixed month="MAY" day="8"/>
	  <tns:Fixed month="JULY" day="5"/>
	  <tns:Fixed month="JULY" day="6"/>
	  <tns:Fixed month="SEPTEMBER" day="28"/>
	  <tns:Fixed month="OCTOBER" day="28"/>
	  <tns:Fixed month="NOVEMBER" day="17"/>
	  <tns:Fixed month="DECEMBER" day="24"/>
	  <tns:Fixed month="DECEMBER" day="25"/>
	  <tns:Fixed month="DECEMBER" day="26"/>
	  <tns:RelativeToEastern days="1"/>
  </tns:Holidays>
</tns:Configuration>
