<?xml version="1.0" encoding="UTF-8"?>
<tns:Configuration hierarchy="at" description="Austria"
	xmlns:tns="http://www.example.org/Holiday" xmlns:xsi="http://www.w3.org/2001/XMLSchema-instance"
	xsi:schemaLocation="http://www.example.org/Holiday Holiday.xsd ">
	<tns:Holidays>
		<tns:Fixed month="JANUARY" day="1" />
		<tns:Fixed month="JANUARY" day="6" />
		<tns:Fixed month="MAY" day="1" />
		<tns:Fixed month="AUGUST" day="15" />
		<tns:Fixed month="OCTOBER" day="26" />
		<tns:Fixed month="NOVEMBER" day="1" />
		<tns:Fixed month="DECEMBER" day="8" />
		<tns:Fixed month="DECEMBER" day="24" />
		<tns:Fixed month="DECEMBER" day="25" />
		<tns:Fixed month="DECEMBER" day="26" />
		<tns:Fixed month="DECEMBER" day="31" />
		<tns:ChristianHoliday type="GOOD_FRIDAY" />
		<tns:ChristianHoliday type="EASTER_MONDAY" />
		<tns:ChristianHoliday type="ASCENSION_DAY" />
		<tns:ChristianHoliday type="WHIT_MONDAY" />
		<tns:ChristianHoliday type="CORPUS_CHRISTI" />
	</tns:Holidays>
	<tns:SubConfigurations hierarchy="b" description="Burgenland">
		<tns:Holidays>
			<tns:Fixed month="NOVEMBER" day="11"/>
		</tns:Holidays>
	</tns:SubConfigurations>
	<tns:SubConfigurations hierarchy="k" description="Kärnten">
		<tns:Holidays>
			<tns:Fixed month="MARCH" day="19"/>
			<tns:Fixed month="OCTOBER" day="10"/>
		</tns:Holidays>
	</tns:SubConfigurations>
	<tns:SubConfigurations hierarchy="nö" description="Niederösterreich">
		<tns:Holidays>
			<tns:Fixed month="NOVEMBER" day="15"/>
		</tns:Holidays>
	</tns:SubConfigurations>
	<tns:SubConfigurations hierarchy="oö" description="Oberösterreich">
		<tns:Holidays>
			<tns:Fixed month="MAY" day="4"/>
		</tns:Holidays>
	</tns:SubConfigurations>
	<tns:SubConfigurations hierarchy="s" description="Salzburg">
		<tns:Holidays>
			<tns:Fixed month="SEPTEMBER" day="24"/>
		</tns:Holidays>
	</tns:SubConfigurations>
	<tns:SubConfigurations hierarchy="st" description="Steiermark">
		<tns:Holidays>
			<tns:Fixed month="MARCH" day="19"/>
		</tns:Holidays>
	</tns:SubConfigurations>
	<tns:SubConfigurations hierarchy="t" description="Tirol">
		<tns:Holidays>
			<tns:Fixed month="MARCH" day="19"/>
		</tns:Holidays>
	</tns:SubConfigurations>
	<tns:SubConfigurations hierarchy="va" description="Vorarlberg">
		<tns:Holidays>
			<tns:Fixed month="MARCH" day="19"/>
		</tns:Holidays>
	</tns:SubConfigurations>
	<tns:SubConfigurations hierarchy="w" description="Wien">
		<tns:Holidays>
			<tns:Fixed month="NOVEMBER" day="15"/>
		</tns:Holidays>
	</tns:SubConfigurations>
</tns:Configuration>
