<?xml version="1.0" encoding="UTF-8"?>
<tns:Configuration hierarchy="be" description="Belgium" xmlns:tns="http://www.example.org/Holiday" xmlns:xsi="http://www.w3.org/2001/XMLSchema-instance" xsi:schemaLocation="http://www.example.org/Holiday Holiday.xsd ">
  <tns:Holidays>
	  <tns:Fixed month="JANUARY" day="1"/>
	  <tns:Fixed month="MAY" day="1"/>
	  <tns:Fixed month="JULY" day="21"/>
	  <tns:Fixed month="AUGUST" day="15"/>
	  <tns:Fixed month="NOVEMBER" day="1"/>
	  <tns:Fixed month="NOVEMBER" day="11"/>
	  <tns:Fixed month="DECEMBER" day="25"/>
	  <tns:RelativeToEastern days="1"/>
	  <tns:RelativeToEastern days="39"/>
	  <tns:RelativeToEastern days="50"/>
  </tns:Holidays>
  <tns:SubConfigurations hierarchy="fl" description="Flemish community">
  	<tns:Holidays>
  		<tns:Fixed month="JULY" day="11"/>
  	</tns:Holidays>
  </tns:SubConfigurations>
  <tns:SubConfigurations hierarchy="fr" description="French community">
  	<tns:Holidays>
  		<tns:Fixed month="SEPTEMBER" day="27"/>
  	</tns:Holidays>
  </tns:SubConfigurations>
  <tns:SubConfigurations hierarchy="ge" description="German community">
  	<tns:Holidays>
  		<tns:Fixed month="NOVEMBER" day="15"/>
  	</tns:Holidays>
  </tns:SubConfigurations>
</tns:Configuration>
