<?xml version="1.0" encoding="UTF-8"?>
<tns:Configuration hierarchy="pe" description="Peru"
	xmlns:tns="http://www.example.org/Holiday" xmlns:xsi="http://www.w3.org/2001/XMLSchema-instance"
	xsi:schemaLocation="http://www.example.org/Holiday Holiday.xsd ">
  <tns:Holidays>
	  <tns:Fixed month="JANUARY" day="1"/>
	  <tns:Fixed month="MAY" day="1"/>
	  <tns:Fixed month="JUNE" day="29"/>
	  <tns:Fixed month="JULY" day="28"/>
	  <tns:Fixed month="JULY" day="29"/>
	  <tns:Fixed month="AUGUST" day="30"/>
	  <tns:Fixed month="OCTOBER" day="8"/>
	  <tns:Fixed month="NOVEMBER" day="1"/>
	  <tns:Fixed month="DECEMBER" day="8"/>
	  <tns:Fixed month="DECEMBER" day="25"/>
	  <tns:ChristianHoliday type="MAUNDY_THURSDAY"/>
	  <tns:ChristianHoliday type="GOOD_FRIDAY"/>
  </tns:Holidays>
</tns:Configuration>
