<?xml version="1.0" encoding="UTF-8"?>
<tns:Configuration hierarchy="nl" description="Netherlands" xmlns:tns="http://www.example.org/Holiday" xmlns:xsi="http://www.w3.org/2001/XMLSchema-instance" xsi:schemaLocation="http://www.example.org/Holiday Holiday.xsd ">
  <tns:Holidays>
	  <tns:Fixed month="JANUARY" day="1"/>
	  <tns:Fixed month="APRIL" day="30"/>
	  <tns:Fixed month="DECEMBER" day="25"/>
	  <tns:Fixed month="DECEMBER" day="26"/>
	  <tns:RelativeToEastern days="-2"/>
	  <tns:RelativeToEastern days="1"/>
 	  <tns:RelativeToEastern days="39"/>
 	  <tns:RelativeToEastern days="50"/>
  </tns:Holidays>
</tns:Configuration>
