<?xml version="1.0" encoding="UTF-8"?>
<tns:Configuration hierarchy="md" description="Moldova"
	xmlns:tns="http://www.example.org/Holiday" xmlns:xsi="http://www.w3.org/2001/XMLSchema-instance"
	xsi:schemaLocation="http://www.example.org/Holiday /Holiday.xsd">
	<tns:Holidays>
		<tns:Fixed month="JANUARY" day="1" />
		<tns:Fixed month="JANUARY" day="7" />
		<tns:Fixed month="JANUARY" day="8" />
		<tns:Fixed month="MAY" day="1" />
		<tns:Fixed month="MAY" day="9" />
		<tns:Fixed month="AUGUST" day="27" />
		<tns:Fixed month="AUGUST" day="31" />
		<tns:Fixed month="OCTOBER" day="11" />
		<tns:Fixed month="OCTOBER" day="23" />
		<tns:Fixed month="DECEMBER" day="8" />
		<tns:ChristianHoliday type="EASTER" />
		<tns:ChristianHoliday type="EASTER_MONDAY" chronology="JULIAN" />
	</tns:Holidays>
	<tns:SubConfigurations hierarchy="ch" description="Chisinau">
		<tns:Holidays>
			<tns:Fixed month="MAY" day="22"/>
		</tns:Holidays>
	</tns:SubConfigurations>
</tns:Configuration>
