<?xml version="1.0" encoding="UTF-8"?>
<tns:Configuration hierarchy="al" description="Albania" xmlns:tns="http://www.example.org/Holiday" xmlns:xsi="http://www.w3.org/2001/XMLSchema-instance" xsi:schemaLocation="http://www.example.org/Holiday Holiday.xsd ">
  <tns:Holidays>
	  <tns:Fixed month="JANUARY" day="1"/>
	  <tns:Fixed month="MAY" day="1"/>
	  <tns:Fixed month="NOVEMBER" day="28"/>
	  <tns:Fixed month="NOVEMBER" day="29"/>
	  <tns:Fixed month="DECEMBER" day="25"/>
	  <tns:RelativeToEastern days="-2"/>
	  <tns:RelativeToEastern days="1"/>
	  <tns:RelativeToEastern days="39"/>
	  <tns:RelativeToEastern days="50"/>
	  <tns:IslamicHoliday name="ID_UL_ADHA"/>
	  <tns:IslamicHoliday name="ID_AL_FITR"/>
  </tns:Holidays>
</tns:Configuration>
