<?xml version="1.0" encoding="UTF-8"?>
<tns:Configuration hierarchy="si" description="Slovenia"
	xmlns:tns="http://www.example.org/Holiday" xmlns:xsi="http://www.w3.org/2001/XMLSchema-instance"
	xsi:schemaLocation="http://www.example.org/Holiday /Holiday.xsd">
	<tns:Holidays>
		<tns:Fixed month="JANUARY" day="1" descriptionPropertiesKey="NEW_YEAR"/>
		<tns:Fixed month="JANUARY" day="2" />
		<tns:Fixed month="FEBRUARY" day="8" />
		<tns:Fixed month="APRIL" day="23" />
		<tns:Fixed month="APRIL" day="27" />
		<tns:Fixed month="MAY" day="1" descriptionPropertiesKey="LABOUR_DAY"/>
		<tns:Fixed month="MAY" day="2" />
		<tns:Fixed month="JUNE" day="25" />
		<tns:Fixed month="AUGUST" day="15" />
		<tns:Fixed month="OCTOBER" day="31" />
		<tns:Fixed month="NOVEMBER" day="1" />
		<tns:Fixed month="NOVEMBER" day="11" />
		<tns:Fixed month="OCTOBER" day="31" />
		<tns:Fixed month="DECEMBER" day="6" />
		<tns:Fixed month="DECEMBER" day="25" descriptionPropertiesKey="CHRISTMAS"/>
		<tns:Fixed month="DECEMBER" day="26" />
		<tns:ChristianHoliday type="EASTER" />
		<tns:ChristianHoliday type="EASTER_MONDAY" />
		<tns:ChristianHoliday type="MARDI_GRAS"/>
	</tns:Holidays>
</tns:Configuration>
