<?xml version="1.0" encoding="UTF-8"?>
<tns:Configuration hierarchy="br" description="Brazil"
	xmlns:tns="http://www.example.org/Holiday" xmlns:xsi="http://www.w3.org/2001/XMLSchema-instance"
	xsi:schemaLocation="http://www.example.org/Holiday Holiday.xsd ">
	<tns:Holidays>
		<tns:Fixed month="JANUARY" day="1" />
		<tns:Fixed month="APRIL" day="21" />
		<tns:Fixed month="MAY" day="1" />
		<tns:Fixed month="SEPTEMBER" day="7" />
		<tns:Fixed month="OCTOBER" day="12" />
		<tns:Fixed month="NOVEMBER" day="2" />
		<tns:Fixed month="NOVEMBER" day="15" />
		<tns:Fixed month="DECEMBER" day="25"/>
		<tns:ChristianHoliday type="CARNIVAL"/>
		<tns:ChristianHoliday type="ASH_WEDNESDAY"/>
		<tns:ChristianHoliday type="GOOD_FRIDAY"/>
		<tns:ChristianHoliday type="CORPUS_CHRISTI"/>
	</tns:Holidays>
	<tns:SubConfigurations hierarchy="rj" description="Rio de Janeiro">
		<tns:Holidays>
			<tns:Fixed month="APRIL" day="23" validFrom="2007"/>
			<tns:Fixed month="NOVEMBER" day="20"/>
		</tns:Holidays>
		<tns:SubConfigurations hierarchy="crj" description="City of Rio de Janeiro">
			<tns:Holidays>
				<tns:Fixed month="JANUARY" day="20"/>
				<tns:Fixed month="APRIL" day="23" validTo="2006"/>
			</tns:Holidays>
		</tns:SubConfigurations>
	</tns:SubConfigurations>
	<tns:SubConfigurations hierarchy="s" description="Sao Paulo">
		<tns:Holidays>
			<tns:Fixed month="JULY" day="9"/>
			<tns:Fixed month="NOVEMBER" day="20"/>
		</tns:Holidays>
		<tns:SubConfigurations hierarchy="cs" description="City of Sao Paulo">
			<tns:Holidays>
				<tns:Fixed month="JANUARY" day="25"/>
				<tns:Fixed month="NOVEMBER" day="4"/>
			</tns:Holidays>
		</tns:SubConfigurations>
	</tns:SubConfigurations>
	<tns:SubConfigurations hierarchy="mg" description="Minas Gerais">
		<tns:Holidays></tns:Holidays>
		<tns:SubConfigurations hierarchy="bh" description="Belo Horizonte">
			<tns:Holidays>
				<tns:Fixed month="AUGUST" day="15"/>
				<tns:Fixed month="DECEMBER" day="8"/>
			</tns:Holidays>
		</tns:SubConfigurations>
	</tns:SubConfigurations>
	<tns:SubConfigurations hierarchy="ms" description="Mato Grosso do Sul">
		<tns:Holidays>
			<tns:Fixed month="OCTOBER" day="11"/>
		</tns:Holidays>
		<tns:SubConfigurations hierarchy="cg" description="Campo Grande">
			<tns:Holidays>
				<tns:Fixed month="AUGUST" day="26"/>
			</tns:Holidays>
		</tns:SubConfigurations>
		<tns:SubConfigurations hierarchy="do" description="Dourados">
			<tns:Holidays>
				<tns:Fixed month="DECEMBER" day="8"/>
			</tns:Holidays>
		</tns:SubConfigurations>
	</tns:SubConfigurations>
	<tns:SubConfigurations hierarchy="pr" description="Parana">
		<tns:Holidays></tns:Holidays>
		<tns:SubConfigurations hierarchy="cu" description="Curitiba">
			<tns:Holidays>
				<tns:Fixed month="SEPTEMBER" day="8"/>
			</tns:Holidays>
		</tns:SubConfigurations>
	</tns:SubConfigurations>
	<tns:SubConfigurations hierarchy="rs" description="Rio Grande do Sul">
		<tns:Holidays>
			<tns:Fixed month="SEPTEMBER" day="20"/>
		</tns:Holidays>
		<tns:SubConfigurations hierarchy="sm" description="Santa Maria">
			<tns:Holidays>
				<tns:Fixed month="DECEMBER" day="8"/>
			</tns:Holidays>
		</tns:SubConfigurations>
	</tns:SubConfigurations>
	<tns:SubConfigurations hierarchy="rn" description="Rio Grande do Norte">
		<tns:Holidays>
			<tns:Fixed month="OCTOBER" day="3"/>
		</tns:Holidays>
		<tns:SubConfigurations hierarchy="na" description="Natal">
			<tns:Holidays>
				<tns:Fixed month="NOVEMBER" day="21"/>
			</tns:Holidays>
		</tns:SubConfigurations>
	</tns:SubConfigurations>
	<tns:SubConfigurations hierarchy="go" description="GoiÃ¡s">
		<tns:Holidays>
			<tns:Fixed month="OCTOBER" day="24"/>
		</tns:Holidays>
	</tns:SubConfigurations>
	<tns:SubConfigurations hierarchy="pe" description="Pernambuco">
		<tns:Holidays>
			<tns:Fixed month="DECEMBER" day="8"/>
		</tns:Holidays>
	</tns:SubConfigurations>
</tns:Configuration>
